[
  {
    "schema_version": "2.0.0",
    "run_id": "cea70b4e-3f08-4abc-9cd8-e62c796d685f",
    "framework": "react-scratch",
    "repetition_index": 1,
    "case_id": "1.1",
    "case_metadata": {
      "case_id": "1.1",
      "tier": "T1",
      "category": "price_check",
      "query_language": "EN",
      "tool_dag": "A",
      "evaluation_priority_note": "The most critical check is that the agent correctly identifies 'AAPL' as the ticker and uses the 'get_stock_price' tool.",
      "implied_tickers": [
        "AAPL"
      ],
      "edge_case_tags": [
        "implicit_ticker"
      ],
      "expected_tools": "[{\"dag_position\": \"single\", \"is_optional\": false, \"params\": {\"ticker\": \"AAPL\"}, \"tool\": \"get_stock_price\"}]",
      "parameter_extraction": "{\"default_expected\": {}, \"explicit\": {}, \"implicit_from_context\": {\"ticker\": \"AAPL\"}}",
      "reference_key_points": "{\"content\": [\"The answer must include the current share price of Apple (AAPL) as a numeric value\", \"The answer should ideally mention the currency of the price (e.g., USD)\"], \"structural\": []}",
      "judge_hints": "{\"failure_signals\": [\"Agent calls 'get_stock_fundamentals' or 'get_company_info' instead of 'get_stock_price' for the current price\", \"Agent hallucinates a price without calling any tool\", \"Agent fails to resolve 'Apple' to the ticker 'AAPL'\"], \"focus_dimensions\": [\"tool_selection\", \"param_extraction\"], \"grading_notes\": \"This is a basic T1 case. The primary goal is to verify the agent can map a company name to a ticker and select the most efficient tool for a real-time price check.\", \"lenient_on\": [\"Whether the agent includes additional data returned by the tool (e.g., daily change, change percent)\", \"The verbosity of the final response (e.g., 'The price is $X' vs 'Apple's current share price is $X')\"], \"strict_requirements\": [\"Agent must call 'get_stock_price' with the ticker 'AAPL'\", \"The final answer must contain the price returned by the tool\"]}",
      "acceptable_tool_alternatives": "[{\"dag\": \"A\", \"impact_on_evaluation\": \"Judge should penalize slightly for efficiency, but accept if the correct current price is retrieved.\", \"rationale\": \"While 'get_stock_price' is the primary tool, 'get_stock_fundamentals' often contains price-related data in the underlying yfinance info object, though it is less direct.\", \"tools\": [\"get_stock_fundamentals\"]}]",
      "reference_trace": "{\"confidence\": 1.0, \"parallel_groups\": [[1]], \"tool_sequence\": [\"get_stock_price\"]}",
      "generation_metadata": "{\"generation_retries\": 0, \"p5_quality_scores\": {\"evaluation_material_quality\": 1.0, \"overall_case_quality\": 1.0, \"query_quality\": 1.0}, \"p5_verdict\": \"pass\", \"repairs_applied\": false}"
    },
    "is_synthetic": false,
    "prompt": "What is the current share price of Apple?",
    "model": "Qwen/Qwen3.5-122B-A10B",
    "model_params": {
      "temperature": 0.0,
      "top_p": null,
      "seed": null,
      "max_tokens": 4096
    },
    "num_agents": 1,
    "total_steps": 2,
    "agents": [
      {
        "agent_id": "react-agent-0",
        "role": "react-agent",
        "system_prompt_hash": null,
        "steps": [
          {
            "step_id": "step-41bdc534-8254-44c4-93bc-9bf96cc17e1c",
            "step_index": 0,
            "step_type": "tool_call",
            "started_at": "2026-07-10T06:32:10.480316+00:00",
            "ended_at": "2026-07-10T06:32:24.178068+00:00",
            "duration_ms": 13697.661,
            "reasoning_content": "Kullanıcı Apple'ın güncel hisse fiyatını soruyor, bu bilgiyi get_current_stock_price aracı ile alabilirim.",
            "input_context": null,
            "output": "Kullanıcı Apple'ın güncel hisse fiyatını soruyor, bu bilgiyi get_current_stock_price aracı ile alabilirim.",
            "tool_calls": [
              {
                "tool_call_id": "tc-d030323f-43e8-44f9-9ef4-9a314be7001a",
                "tool_name": "get_current_stock_price",
                "tool_input": {
                  "input": "AAPL"
                },
                "tool_output": "AAPL: 316.22 USD",
                "success": true,
                "error_message": null,
                "latency_ms": 11741.071
              }
            ],
            "llm_calls": [
              {
                "llm_call_id": "llm-e3e305f9-f4fc-4077-958e-0882568494b0",
                "input_tokens": 844,
                "output_tokens": 92,
                "duration_ms": 1956.59
              }
            ]
          },
          {
            "step_id": "step-db97cfaf-32ba-46ef-bd41-22d478ff1116",
            "step_index": 1,
            "step_type": "synthesis",
            "started_at": "2026-07-10T06:32:24.178135+00:00",
            "ended_at": "2026-07-10T06:32:26.079253+00:00",
            "duration_ms": 1901.058,
            "reasoning_content": "Apple'ın güncel hisse fiyatını aldım, şimdi kullanıcıya Türkçe olarak yanıt verebilirim.",
            "input_context": null,
            "output": "Apple'ın güncel hisse fiyatını aldım, şimdi kullanıcıya Türkçe olarak yanıt verebilirim.",
            "tool_calls": [],
            "llm_calls": [
              {
                "llm_call_id": "llm-629b208e-8eae-450a-bbb9-1e88091216be",
                "input_tokens": 904,
                "output_tokens": 115,
                "duration_ms": 1901.058
              }
            ]
          }
        ],
        "tokens": {
          "input": 1748,
          "output": 207
        }
      }
    ],
    "final_answer": "Apple'ın (AAPL) güncel hisse fiyatı 316.22 USD'dir.",
    "status": "success",
    "error_info": null,
    "tokens": {
      "input": 1748,
      "output": 207,
      "total": 1955
    },
    "latency": {
      "total_ms": 15599.072,
      "planning_ms": null,
      "tool_execution_ms": 11741.071,
      "llm_inference_ms": 3857.648
    },
    "timestamps": {
      "started_at": "2026-07-10T06:32:10.480207+00:00",
      "ended_at": "2026-07-10T06:32:26.079274+00:00"
    },
    "trace_id": null
  },
  {
    "schema_version": "2.0.0",
    "run_id": "bdafc6a4-c773-4004-b7b5-574a322fd533",
    "framework": "react-scratch",
    "repetition_index": 1,
    "case_id": "1.10",
    "case_metadata": {
      "case_id": "1.10",
      "tier": "T1",
      "category": "market_research",
      "query_language": "TR",
      "tool_dag": "A",
      "evaluation_priority_note": "The judge should primarily ensure the agent uses 'web_search' and does not hallucinate a ticker to use other tools.",
      "implied_tickers": [],
      "edge_case_tags": [
        "turkish_query"
      ],
      "expected_tools": "[{\"dag_position\": \"single\", \"is_optional\": false, \"params\": {\"query\": \"global AI chip demand trends and market expectations\"}, \"tool\": \"web_search\"}]",
      "parameter_extraction": "{\"default_expected\": {}, \"explicit\": {\"query\": \"Yapay zeka çiplerine yönelik küresel talep trendleri ve pazar beklentileri\"}, \"implicit_from_context\": {}}",
      "reference_key_points": "{\"content\": [\"The answer must provide current information on global AI chip demand trends\", \"The answer must include market expectations for the AI chip sector\", \"The response must be based on the results returned by the web_search tool\"], \"structural\": []}",
      "judge_hints": "{\"failure_signals\": [\"Agent attempts to use a ticker-based tool (e.g., get_stock_fundamentals) without a specific company being mentioned\", \"Agent answers the query using internal knowledge without calling any tool\", \"Agent fails to provide a response in Turkish (the language of the query)\"], \"focus_dimensions\": [], \"grading_notes\": \"This is a T1 case. The primary goal is to verify the agent recognizes that a general market trend question requires a web search rather than a financial ticker tool.\", \"lenient_on\": [\"The exact wording of the search query\", \"Whether the agent translates the Turkish query to English for the tool call\", \"The verbosity of the final summary\", \"The number of web_search calls (multiple calls to refine results are acceptable)\"], \"strict_requirements\": [\"Agent must use the 'web_search' tool\", \"The search query must be relevant to 'AI chip demand' and 'market expectations' (can be in English or Turkish)\"]}",
      "acceptable_tool_alternatives": "[{\"dag\": \"A\", \"impact_on_evaluation\": \"none\", \"rationale\": \"No other tool in the toolkit provides general market research or trend analysis. All other tools require a specific stock ticker.\", \"tools\": [\"web_search\"]}]",
      "reference_trace": "{\"confidence\": 1.0, \"parallel_groups\": [[1, 2]], \"tool_sequence\": [\"web_search\", \"web_search\"]}",
      "generation_metadata": "{\"generation_retries\": 0, \"p5_quality_scores\": {\"evaluation_material_quality\": 0.95, \"overall_case_quality\": 0.98, \"query_quality\": 1.0}, \"p5_verdict\": \"pass_with_repairs\", \"repairs_applied\": true}"
    },
    "is_synthetic": false,
    "prompt": "Yapay zeka çiplerine yönelik küresel talep trendleri ve pazar beklentileri hakkında güncel bilgiler nelerdir?",
    "model": "Qwen/Qwen3.5-122B-A10B",
    "model_params": {
      "temperature": 0.0,
      "top_p": null,
      "seed": null,
      "max_tokens": 4096
    },
    "num_agents": 1,
    "total_steps": 2,
    "agents": [
      {
        "agent_id": "react-agent-0",
        "role": "react-agent",
        "system_prompt_hash": null,
        "steps": [
          {
            "step_id": "step-5453ad8a-eb51-4e4a-898e-9a0e808dafbc",
            "step_index": 0,
            "step_type": "tool_call",
            "started_at": "2026-07-10T06:32:26.083680+00:00",
            "ended_at": "2026-07-10T06:32:32.193804+00:00",
            "duration_ms": 6110.008,
            "reasoning_content": "Yapay zeka çipi pazar trendleri için web'de arama yapmalıyım.",
            "input_context": null,